7140201,"Giáo dục Mầm non","M02; M03; M05; M06",19,18,600,1,"2022-04-15 13:45:53","2022-04-15 13:45:53"
7140202,"Giáo dục Tiểu học","A00; A01; C00; D01",20,18,0,1,"2022-04-15 13:45:53","2022-04-15 13:45:53"
7140205,"Giáo dục Chính trị","C00; C19; D01; D66",19,18,0,1,"2022-04-15 13:45:53","2022-04-15 13:45:53"
7140209,"Sư phạm Toán học","A00; A01; C01; D01",22,18,0,1,"2022-04-15 13:45:53","2022-04-15 13:45:53"
7140211,"Sư phạm Vật lý","A00; A01; C01; C05",19,18,0,1,"2022-04-15 13:45:53","2022-04-15 13:45:53"
7140212,"Sư phạm Hóa học","A00; B00; C02; D07",19,18,0,1,"2022-04-15 13:45:53","2022-04-15 13:45:53"
7140217,"Sư phạm Ngữ văn","C00; D01; D14; D15",22,18,0,1,"2022-04-15 13:45:53","2022-04-15 13:45:53"
7140218,"Sư phạm Lịch sử","A08; C00; C19; D14",20,18,0,1,"2022-04-15 13:45:53","2022-04-15 13:45:53"
7140219,"Sư phạm Địa lý","A09; C00; C04; D10",20,18,0,1,"2022-04-15 13:45:53","2022-04-15 13:45:53"
7140231,"Sư phạm Tiếng Anh","A01; D01; D09; D14",22.5,18,0,1,"2022-04-15 13:45:53","2022-04-15 13:45:53"
7340101,"Quản trị kinh doanh","A00; A01; C15; D01",23,22.5,600,1,"2022-04-15 13:45:53","2022-04-15 13:45:53"
7340115,Marketing,"A00; A01; C15; D01",23,22.5,600,1,"2022-04-15 13:45:53","2022-04-15 13:45:53"
7340201,"Tài chính - Ngân hàng","A00; A01; C15; D01",20.5,18,600,1,"2022-04-15 13:45:53","2022-04-15 13:45:53"
7340301,"Kế toán","A00; A01; C15; D01",21.5,18,600,1,"2022-04-15 13:45:53","2022-04-15 13:45:53"
7380101,Luật,"A01; C00; C01; D01",23.5,20,600,1,"2022-04-15 13:45:53","2022-04-15 13:45:53"
7420201,"Công nghệ sinh học","A16; B00; B03; D01",16,18,600,1,"2022-04-15 13:45:53","2022-04-15 13:45:53"
7480103,"Kỹ thuật phần mềm","A00; A01; C01; D01",16,18,600,1,"2022-04-15 13:45:53","2022-04-15 13:45:53"
7480201,"Công nghệ thông tin","A00; A01; C01; D01",19,19,600,1,"2022-04-15 13:45:53","2022-04-15 13:45:53"
7510406,"Công nghệ kỹ thuật môi trường","A00; A01; B00; D07",16,21,600,1,"2022-04-15 13:45:53","2022-04-15 13:45:53"
7510401,"Công nghệ kỹ thuật hoá học","A00; A01; B00; D07",16,23,600,1,"2022-04-15 13:45:53","2022-04-15 13:45:53"
7540101,"Công nghệ thực phẩm","A00; B00; C05; D01",16,18,600,1,"2022-04-15 13:45:53","2022-04-15 13:45:53"
7620105,"Chăn nuôi","A00; B00; C08; D01",16,18,600,1,"2022-04-15 13:45:53","2022-04-15 13:45:53"
7620110,"Khoa học cây trồng","A00; B00; C15; D01",16,18,600,1,"2022-04-15 13:45:53","2022-04-15 13:45:53"
7620112,"Bảo vệ thực vật","A00; B00; C15; D01",16,20,600,1,"2022-04-15 13:45:53","2022-04-15 13:45:53"
7620116,"Phát triển nông thôn","A00; B00; C00; D01",16,18,600,1,"2022-04-15 13:45:53","2022-04-15 13:45:53"
7620301,"Nuôi trồng thủy sản","A00; B00; D01; D10",16,18,600,1,"2022-04-15 13:45:53","2022-04-15 13:45:53"
7310630,"Việt Nam học","A01; C00; C04; D01",16.5,18,600,1,"2022-04-15 13:45:53","2022-04-15 13:45:53"
7220201,"Ngôn ngữ Anh","A01; D01; D09; D14",17.5,18,600,1,"2022-04-15 13:45:53","2022-04-15 13:45:53"
7229030,"Văn học","C00; D01; D14; D15",16,18,600,1,"2022-04-15 13:45:53","2022-04-15 13:45:53"
7310106,"Kinh tế quốc tế","A00; A01; C15; D01",17,18,600,1,"2022-04-15 13:45:53","2022-04-15 13:45:53"
7850101,"Quản lý tài nguyên và môi trường","A00; A01; B00; D07",16,20,600,1,"2022-04-15 13:45:53","2022-04-15 13:45:53"
7229001,"Triết học","A01; C00; C01; D01",16,18,600,1,"2022-04-15 13:45:53","2022-04-15 13:45:53"
7340101,"Quản trị kinh doanh","A00; C00; C20; D01",15,18,0,2,"2022-04-15 13:45:53","2022-04-15 13:45:53"
7340301,"Kế toán","A00; A09; C04; D01",15,0,0,2,"2022-04-15 13:45:53","2022-04-15 13:45:53"
7340201,"Tài chính - Ngân hàng","A00; A01; D09; D01",15,18,0,2,"2022-04-15 13:45:53","2022-04-15 13:45:53"
7340116,"Bất động sản","A00; C04; C01; D01",15,18,0,2,"2022-04-15 13:45:53","2022-04-15 13:45:53"
7340115,Marketing,"A00; A09; C01; D01",15,0,0,2,"2022-04-15 13:45:53","2022-04-15 13:45:53"
7380101,Luật,"A00; A01; C00; D01",15,18,0,2,"2022-04-15 13:45:53","2022-04-15 13:45:53"
7510605,"Logistics và quản lý chuỗi cung ứng","A00; C00; C04; D01",15,18,0,2,"2022-04-15 13:45:53","2022-04-15 13:45:53"
7310608,"Đông phương học","C00; C20; D01; C19",15,18,0,2,"2022-04-15 13:45:53","2022-04-15 13:45:53"
7220204,"Ngôn ngữ Trung Quốc","C00; C20; D01; D15",15,18,0,2,"2022-04-15 13:45:53","2022-04-15 13:45:53"
7220201,"Ngôn ngữ Anh","A01; D01; D14; D15",15,18,0,2,"2022-04-15 13:45:53","2022-04-15 13:45:53"
7310401,"Tâm lý học","C00; C20; D01; D15",15,18,0,2,"2022-04-15 13:45:53","2022-04-15 13:45:53"
7480201,"Công nghệ thông tin","A00; A01; A02; D01",15,0,0,2,"2022-04-15 13:45:53","2022-04-15 13:45:53"
7510201,"Công nghệ kỹ thuật cơ khí","A00; A01; A02; D01",15,0,0,2,"2022-04-15 13:45:53","2022-04-15 13:45:53"
7510205,"Công nghệ kỹ thuật ô tô","A00; A01; A02; D01",15,0,0,2,"2022-04-15 13:45:53","2022-04-15 13:45:53"
7510301,"Công nghệ kỹ thuật điện; điện tử","A00; A01; A02; D01",15,0,0,2,"2022-04-15 13:45:53","2022-04-15 13:45:53"
7510102,"Công nghệ kỹ thuật công trình xây dựng","A00; A01; A02; C01",15,0,0,2,"2022-04-15 13:45:53","2022-04-15 13:45:53"
7510401,"Công nghệ kỹ thuật hoá học","A00; A01; B00; D07",15,0,0,2,"2022-04-15 13:45:53","2022-04-15 13:45:53"
7540101,"Công nghệ thực phẩm","A00; B00; B03; C08",15,0,0,2,"2022-04-15 13:45:53","2022-04-15 13:45:53"
7810103,"Quản trị dịch vụ du lịch và lữ hành","A00; C00; C20; D01",15,18,0,2,"2022-04-15 13:45:53","2022-04-15 13:45:53"
7810201,"Quản trị khách sạn","A00; C00; C20; D01",15,18,0,2,"2022-04-15 13:45:53","2022-04-15 13:45:53"
7810202,"Quản trị nhà hàng và dịch vụ ăn uống","A00; C00; C01; D01",15,18,0,2,"2022-04-15 13:45:53","2022-04-15 13:45:53"
7720301,"Điều dưỡng","A00; B00; B08; C08",19,0,0,2,"2022-04-15 13:45:53","2022-04-15 13:45:53"
7720201,"Dược học","A00; B00; B08; C08",21,0,0,2,"2022-04-15 13:45:53","2022-04-15 13:45:53"
7620110,"Khoa học cây trồng","A00; A01; B00; D01",15,0,0,4,"2022-04-15 13:45:53","2022-04-15 13:45:53"
7620105,"Chăn nuôi – Thú y","A00; A01; B00; D01",15,0,0,4,"2022-04-15 13:45:53","2022-04-15 13:45:53"
7640101,"Thú y","A00; A01; B00; D01",15,0,0,4,"2022-04-15 13:45:53","2022-04-15 13:45:53"
7850103,"Quản lý đất đai","A00; A01; B00; D01",15,0,0,4,"2022-04-15 13:45:53","2022-04-15 13:45:53"
7850101,"Quản lý tài nguyên và môi trường","A00; A01; B00; D01",15,0,0,4,"2022-04-15 13:45:53","2022-04-15 13:45:53"
7540101,"Công nghệ thực phẩm","A00; A01; B00; D01",15,0,0,4,"2022-04-15 13:45:53","2022-04-15 13:45:53"
7620211,"Quản lý tài nguyên rừng (Kiểm lâm)","A00; A01; B00; D01",15,0,0,4,"2022-04-15 13:45:53","2022-04-15 13:45:53"
7340301,"Kế toán","A00; A01; D01",15,0,0,4,"2022-04-15 13:45:53","2022-04-15 13:45:53"
7620112,"Bảo vệ thực vật","A00; A01; B00; D01",15,0,0,4,"2022-04-15 13:45:53","2022-04-15 13:45:53"
7310101,"Kinh tế","A00; A01; D01",15,0,0,4,"2022-04-15 13:45:53","2022-04-15 13:45:53"
7810103,"Quản trị dịch vụ du lịch và lữ hành","A00; A01; B00; D01",15,0,0,4,"2022-04-15 13:45:53","2022-04-15 13:45:53"
7540106,"Đảm bảo chất lượng và ATTP","A00; A01; B00; D01",15,0,0,4,"2022-04-15 13:45:53","2022-04-15 13:45:53"
7220204,"Ngôn ngữ Trung Quốc","A00; A01; D01",15,0,0,4,"2022-04-15 13:45:53","2022-04-15 13:45:53"
51140201,"Giáo dục Mầm non",M00,17,19.5,0,8,"2022-04-15 13:45:53","2022-04-15 13:45:53"
7140209,"Sư phạm Toán học","A00; B00; A16",19,0,0,8,"2022-04-15 13:45:53","2022-04-15 13:45:53"
7140212,"Sư phạm Hóa học","A00; A01; A16",19,0,0,8,"2022-04-15 13:45:53","2022-04-15 13:45:53"
7140213,"Sư phạm Sinh học","B00; A02; A16",19,0,0,8,"2022-04-15 13:45:53","2022-04-15 13:45:53"
7220101,"Tiếng Việt và VHVN","C00; D01; C15; D78",15,0,0,8,"2022-04-15 13:45:53","2022-04-15 13:45:53"
7220201,"Ngôn ngữ Anh","D01; D09; D14; D78",15,0,0,8,"2022-04-15 13:45:53","2022-04-15 13:45:53"
7340101,"Quản trị kinh doanh","A00; A01; A16; D90",15,0,0,8,"2022-04-15 13:45:53","2022-04-15 13:45:53"
7340201,"Tài chính - Ngân hàng","A00; A01; A16; D90",15,0,0,8,"2022-04-15 13:45:53","2022-04-15 13:45:53"
7340301,"Kế toán","A00; A01; A16; D90",15,0,0,8,"2022-04-15 13:45:53","2022-04-15 13:45:53"
7440301,"Khoa học môi trường","A01; A02; B00; D07",15,0,0,8,"2022-04-15 13:45:53","2022-04-15 13:45:53"
7480201,"Công nghệ thông tin","A00; A01; A16; D90",15,0,0,8,"2022-04-15 13:45:53","2022-04-15 13:45:53"
7620105,"Chăn nuôi","A02; B00; A16; D90",15,0,0,8,"2022-04-15 13:45:53","2022-04-15 13:45:53"
7620112,"Bảo vệ thực vật","A02; B00; A16; D90",15,0,0,8,"2022-04-15 13:45:53","2022-04-15 13:45:53"
7620301,"Nuôi trồng thủy sản","A02; B00; A16; D90",15,0,0,8,"2022-04-15 13:45:53","2022-04-15 13:45:53"
7480201,"Công nghệ thông tin","A00; A01; A02; D01",16.5,18,0,10,"2022-04-15 13:45:53","2022-04-15 13:45:53"
7510202,"công nghệ chế tạo máy","A00; A01; A02; D01",15,18,0,10,"2022-04-15 13:45:53","2022-04-15 13:45:53"
7510205,"Công nghệ kỹ thuật ô tô","A00; A01; A02; D01",16,18,0,10,"2022-04-15 13:45:53","2022-04-15 13:45:53"
7510206,"Công nghệ kỹ thuật nhiệt","A00; A01; A02; D01",15,18,0,10,"2022-04-15 13:45:53","2022-04-15 13:45:53"
7510303,"Công nghệ kỹ thuật điều khiển - tự động hoá","A00; A01; A02; D01",15,18,0,10,"2022-04-15 13:45:53","2022-04-15 13:45:53"
7510301,"Công nghệ kỹ thuật điện - điện tử","A00; A01; A02; D01",15,18,0,10,"2022-04-15 13:45:53","2022-04-15 13:45:53"
7580201,"Kỹ thuật xây dựng","A00; A01; A02; D01",15,18,0,10,"2022-04-15 13:45:53","2022-04-15 13:45:53"
7540101,"Công nghệ thực phẩm","A00; A01; A02; B00",15,18,0,10,"2022-04-15 13:45:53","2022-04-15 13:45:53"
7340101,"Quản trị kinh doanh","A00; A01; D01; C00",16,18,0,10,"2022-04-15 13:45:53","2022-04-15 13:45:53"
7810201,"Quản trị khách sạn","D14; D15; C00; D01",16,18,0,10,"2022-04-15 13:45:53","2022-04-15 13:45:53"
7810103,"Quản trị dịch vụ du lịch và lữ hành","D14; D15; C00; D01",16,18,0,10,"2022-04-15 13:45:53","2022-04-15 13:45:53"
7340201,"Tài chính ngân hàng","A00; A01; D01; C00",15,18,0,10,"2022-04-15 13:45:53","2022-04-15 13:45:53"
7340301,"Kế toán","A00; A01; D01; C00",15,18,0,10,"2022-04-15 13:45:53","2022-04-15 13:45:53"
7720201,"Dược học","A00; A02; B00; D07",21,24,0,10,"2022-04-15 13:45:53","2022-04-15 13:45:53"
7720301,"Điều dưỡng","A00; A02; B00; D07",19,19.5,0,10,"2022-04-15 13:45:53","2022-04-15 13:45:53"
7480200,"Nhóm ngành Kỹ thuật CAND",A00,27.34,0,0,11,"2022-04-15 13:45:53","2022-04-15 13:45:53"
7480200,"Nhóm ngành Kỹ thuật CAND",A01,27.98,0,0,11,"2022-04-15 13:45:53","2022-04-15 13:45:53"
7480200,"Nhóm ngành Kỹ thuật CAND",A00,26.33,0,0,12,"2022-04-15 13:45:53","2022-04-15 13:45:53"
7480200,"Nhóm ngành Kỹ thuật CAND",A01,27.15,0,0,12,"2022-04-15 13:45:53","2022-04-15 13:45:53"
7310202,"Xây dựng Đảng và chính quyền Nhà nước",A00,24.13,0,0,13,"2022-04-15 13:45:53","2022-04-15 13:45:53"
7310202,"Xây dựng Đảng và chính quyền Nhà nước",C00,26.77,0,0,13,"2022-04-15 13:45:53","2022-04-15 13:45:53"
7310202,"Xây dựng Đảng và chính quyền Nhà nước",D01,23.1,0,0,13,"2022-04-15 13:45:53","2022-04-15 13:45:53"
7210403,"Thiết kế đồ họa","V00; V01; H00; H01",15,0,0,15,"2022-04-15 13:45:53","2022-04-15 13:45:53"
7580108,"Thiết kế nội thất","V00; V01; H00; H01",15,0,0,15,"2022-04-15 13:45:53","2022-04-15 13:45:53"
7210404,"Thiết kế thời trang","V00; V01; H00; H01",15,0,0,15,"2022-04-15 13:45:53","2022-04-15 13:45:53"
7340101,"Quản trị kinh doanh","A00; A01; B00; D01",15,0,0,15,"2022-04-15 13:45:53","2022-04-15 13:45:53"
7340201,"Tài chính ngân hàng","A00; A01; B00; D01",15,0,0,15,"2022-04-15 13:45:53","2022-04-15 13:45:53"
7340301,"Kế toán","A00; A01; B00; D01",15,0,0,15,"2022-04-15 13:45:53","2022-04-15 13:45:53"
7380107,"Luật kinh tế","A01; C00; C10; D01",15,0,0,15,"2022-04-15 13:45:53","2022-04-15 13:45:53"
7480201,"Công nghệ thông tin","A01; A10; A15; D90",15,0,0,15,"2022-04-15 13:45:53","2022-04-15 13:45:53"
7510302,"Công nghệ kỹ thuật điện tử viễn thông","A00; A01; D01; 004",15,0,0,15,"2022-04-15 13:45:53","2022-04-15 13:45:53"
7580101,"Kiến trúc","V00; V01",15,0,0,15,"2022-04-15 13:45:53","2022-04-15 13:45:53"
7580302,"Quản lý xây dựng","A00; A01; D01; C04",15,0,0,15,"2022-04-15 13:45:53","2022-04-15 13:45:53"
7720201,"Dược học","A00; A01; B00; D90",21,0,0,15,"2022-04-15 13:45:53","2022-04-15 13:45:53"
7720115,"Y học cổ truyền","A00; A01; B00; D90",21,0,0,15,"2022-04-15 13:45:53","2022-04-15 13:45:53"
7810103,"Quản trị dịch vụ du lịch và lữ hành","A00; A01; D01; C00",15,0,0,15,"2022-04-15 13:45:53","2022-04-15 13:45:53"
7220201,"Ngôn ngữ Anh","D01; A01; D14; D10",15,0,0,15,"2022-04-15 13:45:53","2022-04-15 13:45:53"
7310205,"Quản lý nhà nước","A00; A01; D01; C00",15,0,0,15,"2022-04-15 13:45:53","2022-04-15 13:45:53"
7340101,"Quản trị kinh doanh","A00; A01; D01; C03",14,18,0,22,"2022-04-15 13:45:53","2022-04-15 13:45:53"
7340201,"Tài chính - Ngân hàng","A00; A01; D01; C03",14,18,0,22,"2022-04-15 13:45:53","2022-04-15 13:45:53"
7340301,"Kế toán","A00; A01; D01; C03",14,18,0,22,"2022-04-15 13:45:53","2022-04-15 13:45:53"
7340406,"Quản trị văn phòng","A00; A01; D01; C03",14,18,0,22,"2022-04-15 13:45:53","2022-04-15 13:45:53"
7340115,Marketing,"A00; A01; D01; C03",14,18,0,22,"2022-04-15 13:45:53","2022-04-15 13:45:53"
7480201,"Công nghệ thông tin","A00; A01; C01; D07",14,18,0,22,"2022-04-15 13:45:53","2022-04-15 13:45:53"
7510301,"Công nghệ kỹ thuật điện, điện tử","A00; A01; C01; D07",14,18,0,22,"2022-04-15 13:45:53","2022-04-15 13:45:53"
7580205,"Kỹ thuật xây dựng công trình giao thông","A00; A01; C01; D07",14,18,0,22,"2022-04-15 13:45:53","2022-04-15 13:45:53"
7720201,"Dược học","A00; B00; D07; A02",21,24,0,22,"2022-04-15 13:45:53","2022-04-15 13:45:53"
7340101,"Quản trị kinh doanh","A00; A01; B00; D01",15,0,0,23,"2022-04-15 13:45:53","2022-04-15 13:45:53"
7720301,"Điều dưỡng","A00; A01; B00; D01",19,0,0,23,"2022-04-15 13:45:53","2022-04-15 13:45:53"
7520201,"Kỹ thuật điện","A00; A01; B00; D01",15,0,0,23,"2022-04-15 13:45:53","2022-04-15 13:45:53"
7520216,"Kỹ thuật điều khiển và tự động hóa","A00; A01; B00; D01",15,0,0,23,"2022-04-15 13:45:53","2022-04-15 13:45:53"
7520114,"Kỹ thuật cơ điện tử","A00; A01; B00; D01",15,0,0,23,"2022-04-15 13:45:53","2022-04-15 13:45:53"
7480103,"Kỹ thuật phần mềm","A00; A01; B00; D01",15,0,0,23,"2022-04-15 13:45:53","2022-04-15 13:45:53"
7480102,"Mạng máy tính và truyền thông dữ liệu","A00; A01; B00; D01",15,0,0,23,"2022-04-15 13:45:53","2022-04-15 13:45:53"
7860228,"Chỉ huy kỹ thuật Công binh","A00; A01",24.57,0,0,24,"2022-04-15 13:45:53","2022-04-15 13:45:53"
7140201,"Giáo dục Mầm non","M00; M05; M07; M11",19,24,700,25,"2022-04-15 13:45:53","2022-04-15 13:45:53"
7140202,"Giáo dục Tiểu học","A00; C00; D01; A16",25,28.5,800,25,"2022-04-15 13:45:53","2022-04-15 13:45:53"
7140217,"Sư phạm Ngữ Văn","C00; D01; D14; C15",19,24,700,25,"2022-04-15 13:45:53","2022-04-15 13:45:53"
7140218,"Sư phạm Lịch sử","C00; D01; C14; C15",19,24,700,25,"2022-04-15 13:45:53","2022-04-15 13:45:53"
7340101,"Quản trị Kinh doanh","A00; A01; D01; A16",17.5,22.5,700,25,"2022-04-15 13:45:53","2022-04-15 13:45:53"
7340301,"Kế toán","A00; A01; D01; A16",17.5,20,600,25,"2022-04-15 13:45:53","2022-04-15 13:45:53"
7510605,"Logistics và Quản lý chuỗi cung ứng","A00; A01; D01; D90",17.5,20,600,25,"2022-04-15 13:45:53","2022-04-15 13:45:53"
7340201,"Tài chính - Ngân hàng","A00; A01; D01; A16",16.5,19,600,25,"2022-04-15 13:45:53","2022-04-15 13:45:53"
7510601,"Quản lý Công nghiệp","A00; A01; C01; A16",15,17,550,25,"2022-04-15 13:45:53","2022-04-15 13:45:53"
7810101,"Du lịch","D01; D14; D15; D78",16.5,19,550,25,"2022-04-15 13:45:53","2022-04-15 13:45:53"
7480201,"Công nghệ Thông tin","A00; A01; C01; D90",18,19.5,550,25,"2022-04-15 13:45:53","2022-04-15 13:45:53"
7480103,"Kỹ thuật Phần mềm","A00; A01; C01; D90",16,18,550,25,"2022-04-15 13:45:53","2022-04-15 13:45:53"
7480104,"Hệ thống Thông tin","A00; A01; C01; D90",15,18,550,25,"2022-04-15 13:45:53","2022-04-15 13:45:53"
7520201,"Kỹ thuật Điện","A00; A01; C01; D90",15,17,550,25,"2022-04-15 13:45:53","2022-04-15 13:45:53"
7520216,"Kỹ thuật Điều khiển và tự động hóa","A00; A01; C01; D90",15,17,550,25,"2022-04-15 13:45:53","2022-04-15 13:45:53"
7520114,"Kỹ thuật Cơ điện tử","A00; A01; C01; D90",15,17,550,25,"2022-04-15 13:45:53","2022-04-15 13:45:53"
7510205,"Công nghệ kỹ thuật ô tô","A00; A01; D01; D90",18,20,600,25,"2022-04-15 13:45:53","2022-04-15 13:45:53"
7520207,"Kỹ thuật điện tử - Viễn thông","A00; A01; C01; D90",15,18,550,25,"2022-04-15 13:45:53","2022-04-15 13:45:53"
7480205,"Trí tuệ nhân tạo và khoa học dữ liệu","A00; A01; C01; D90",15,18,550,25,"2022-04-15 13:45:53","2022-04-15 13:45:53"
7580201,"Kỹ thuật Xây dựng","A00; A01; C01; D90",15,18,550,25,"2022-04-15 13:45:53","2022-04-15 13:45:53"
7580101,"Kiến trúc","V00; V01; A00; A16",15,17,550,25,"2022-04-15 13:45:53","2022-04-15 13:45:53"
7549001,"Kỹ nghệ gỗ (Công nghệ Chế biến lâm sản)","A00; A01; B00; D01",15,15,550,25,"2022-04-15 13:45:53","2022-04-15 13:45:53"
7580105,"Quy hoạch Vùng và Đô thị","V00; D01; A00; A16",15,15,550,25,"2022-04-15 13:45:53","2022-04-15 13:45:53"
7580107,"Quản lý Đô thị","V00; D01; A00; A16",15,18,550,25,"2022-04-15 13:45:53","2022-04-15 13:45:53"
7210403,"Thiết kế Đồ họa","V00; V01; A00; D01",16,18.5,550,25,"2022-04-15 13:45:53","2022-04-15 13:45:53"
7210405,"Âm nhạc","M05; M07; M11; M03",15,17,550,25,"2022-04-15 13:45:53","2022-04-15 13:45:53"
7210407,"Mỹ thuật ứng dụng (Mỹ thuật)","D01; V00; V01; V05",15,16,550,25,"2022-04-15 13:45:53","2022-04-15 13:45:53"
7229040,"Văn hóa học","C14; C00; D01; C15",15,16,550,25,"2022-04-15 13:45:53","2022-04-15 13:45:53"
7320104,"Truyền thông đa phương tiện","C00; D01; D09; V01",17,19,550,25,"2022-04-15 13:45:53","2022-04-15 13:45:53"
7760101,"Công tác xã hội","C00; D01; C19; C15",15,18,550,25,"2022-04-15 13:45:53","2022-04-15 13:45:53"
7220201,"Ngôn ngữ Anh","D01; A01; D15; D78",17.5,20,600,25,"2022-04-15 13:45:53","2022-04-15 13:45:53"
7220204,"Ngôn ngữ Trung Quốc","D01; D04; A01; D78",17.5,20,600,25,"2022-04-15 13:45:53","2022-04-15 13:45:53"
7220210,"Ngôn ngữ Hàn Quốc","D01; A01; D15; D78",18,20,600,25,"2022-04-15 13:45:53","2022-04-15 13:45:53"
7380101,Luật,"C14; C00; D01; A16",17.5,20,600,25,"2022-04-15 13:45:53","2022-04-15 13:45:53"
7310205,"Quản lý Nhà nước","C14; C00; D01; A16",15.5,19,600,25,"2022-04-15 13:45:53","2022-04-15 13:45:53"
7310201,"Chính trị học","C14; C00; D01; C19",15,17,550,25,"2022-04-15 13:45:53","2022-04-15 13:45:53"
7850103,"Quản lý Đất đai","A00; D01; B00; B08",15,18,550,25,"2022-04-15 13:45:53","2022-04-15 13:45:53"
7850101,"Quản lý Tài nguyên và Môi trường","A00; D01; B00; B08",15,16,550,25,"2022-04-15 13:45:53","2022-04-15 13:45:53"
7310206,"Quan hệ quốc tế","A00; C00; D01; D78",15,18,550,25,"2022-04-15 13:45:53","2022-04-15 13:45:53"
7520320,"Kỹ thuật Môi trường","A00; D01; B00; B08",15,15,550,25,"2022-04-15 13:45:53","2022-04-15 13:45:53"
7440112,"Hóa học","A00; B00; D07; A16",15,17,550,25,"2022-04-15 13:45:53","2022-04-15 13:45:53"
7420201,"Công nghệ Sinh học","A00; D01; B00; B08",15,16,550,25,"2022-04-15 13:45:53","2022-04-15 13:45:53"
7540101,"Công nghệ Thực phẩm","A00; A02; B00; B08",15,18,550,25,"2022-04-15 13:45:53","2022-04-15 13:45:53"
7540106,"Đảm bảo chất lượng và an toàn thực phẩm","A00; A02; B00; B08",15,18,550,25,"2022-04-15 13:45:53","2022-04-15 13:45:53"
7720401,"Dinh dưỡng","A00; D01; B00; D90",15,15,550,25,"2022-04-15 13:45:53","2022-04-15 13:45:53"
7310401,"Tâm lý học","C00; D01; C14; B08",15,18,550,25,"2022-04-15 13:45:53","2022-04-15 13:45:53"
7140101,"Giáo dục học","C00; D01; C14; C15",15,17,550,25,"2022-04-15 13:45:53","2022-04-15 13:45:53"
7460101,"Toán học","A00; A01; D07; A16",15,18,550,25,"2022-04-15 13:45:53","2022-04-15 13:45:53"
7580101,"Kiến trúc (ARC)","A00; A01; V00; V02",20,0,0,26,"2022-04-15 13:45:53","2022-04-15 13:45:53"
7580201,"Kỹ thuật xây dựng (BCE)","A00; A01; D07",19,0,0,26,"2022-04-15 13:45:53","2022-04-15 13:45:53"
7340101,"Quản trị kinh doanh (BBA)","A00; A01; D01; D03; D05",20,0,0,26,"2022-04-15 13:45:53","2022-04-15 13:45:53"
7340202,"Tài chính và Kế toán (BFA)","A00; A01; D01; D03; D05",20,0,0,26,"2022-04-15 13:45:53","2022-04-15 13:45:53"
7480101,"Khoa học máy tính (CSE)","A00; A01; D07",23,0,0,26,"2022-04-15 13:45:53","2022-04-15 13:45:53"
7520208,"Kỹ thuật điện và máy tính (ECE)","A00; A01; D07",21,0,0,26,"2022-04-15 13:45:53","2022-04-15 13:45:53"
7520103,"Kỹ thuật cơ khí (MEN)","A00; A01; D07",21,0,0,26,"2022-04-15 13:45:53","2022-04-15 13:45:53"
7140114,"Quản lý giáo dục","A00; C00; D01; A01",15,18,0,29,"2022-04-15 13:45:53","2022-04-15 13:45:53"
7140205,"Giáo dục Chính trị","C00; D01; C19",19,24,0,29,"2022-04-15 13:45:53","2022-04-15 13:45:53"
7140213,"Sư phạm Sinh học","B00; B08",19,24,0,29,"2022-04-15 13:45:53","2022-04-15 13:45:53"
7140206,"Giáo dục Thể chất","T00; T02; T03; T05",18,0,0,29,"2022-04-15 13:45:53","2022-04-15 13:45:53"
7140201,"Giáo dục mầm non",M00,19,0,0,29,"2022-04-15 13:45:53","2022-04-15 13:45:53"
7140202,"Giáo dục Tiểu học","A00; C00; D01",24,24.5,0,29,"2022-04-15 13:45:53","2022-04-15 13:45:53"
7140219,"Sư phạm Địa lý","A00; C00; D15",19,24,0,29,"2022-04-15 13:45:53","2022-04-15 13:45:53"
7140212,"Sư phạm Hóa học","A00; B00; D07",25,24,0,29,"2022-04-15 13:45:53","2022-04-15 13:45:53"
7140218,"Sư phạm Lịch sử","C00; C19; D14",19,24,0,29,"2022-04-15 13:45:53","2022-04-15 13:45:53"
7140217,"Sư phạm Ngữ văn","C00; D14; D15",23,24,0,29,"2022-04-15 13:45:53","2022-04-15 13:45:53"
7140231,"Sư phạm Tiếng Anh",D01,24,25,0,29,"2022-04-15 13:45:53","2022-04-15 13:45:53"
7140210,"Sư phạm Tin học","A00; A01; D01",19,24,0,29,"2022-04-15 13:45:53","2022-04-15 13:45:53"
7140209,"sư phạm Toán học","A00; A01",25,26,0,29,"2022-04-15 13:45:53","2022-04-15 13:45:53"
7140211,"Sư phạm Vật lý","A00; A01",19,24,0,29,"2022-04-15 13:45:53","2022-04-15 13:45:53"
7140247,"Sư phạm Khoa học tự nhiên","A00; B00",19,24,0,29,"2022-04-15 13:45:53","2022-04-15 13:45:53"
7140249,"Sư phạm Lịch sử và địa lý","C00; C19; C20",19,24,0,29,"2022-04-15 13:45:53","2022-04-15 13:45:53"
7340301,"Kế toán","A00; A01; D01",15,18,0,29,"2022-04-15 13:45:53","2022-04-15 13:45:53"
7340302,"Kiểm toán","A00; A01; D01",15,18,0,29,"2022-04-15 13:45:53","2022-04-15 13:45:53"
7380101,Luật,"C00; D01; A00; C19",15,18,0,29,"2022-04-15 13:45:53","2022-04-15 13:45:53"
7340101,"Quản trị kinh doanh","A00; A01; D01",15,18,0,29,"2022-04-15 13:45:53","2022-04-15 13:45:53"
7340201,"Tài chính - Ngân hàng","A00; A01; D01",15,18,0,29,"2022-04-15 13:45:53","2022-04-15 13:45:53"
7440112,"Hóa học","A00; D07; B00; D12",15,18,0,29,"2022-04-15 13:45:53","2022-04-15 13:45:53"
7510401,"Công nghệ kỹ thuật Hóa học","A00; C02; B00; D07",15,18,0,29,"2022-04-15 13:45:53","2022-04-15 13:45:53"
7580201,"Kỹ thuật xây dựng","A00; A01; A02; D07",15,18,0,29,"2022-04-15 13:45:53","2022-04-15 13:45:53"
7480201,"Công nghệ thông tin","A00; A01; D01",15,18,0,29,"2022-04-15 13:45:53","2022-04-15 13:45:53"
7520201,"Kỹ thuật điện","A00; A01; A02; D07",15,18,0,29,"2022-04-15 13:45:53","2022-04-15 13:45:53"
7520207,"Kỹ thuật Điện tử - Viễn thông","A00; A01; A02; D07",15,18,0,29,"2022-04-15 13:45:53","2022-04-15 13:45:53"
7480103,"Kỹ thuật phần mềm","A00; A01",15,18,0,29,"2022-04-15 13:45:53","2022-04-15 13:45:53"
7620109,"Nông học","B00; D08; A02; B03",15,18,0,29,"2022-04-15 13:45:53","2022-04-15 13:45:53"
7460112,"Toán ứng dụng","A00; A01; D07; D01",18,18,0,29,"2022-04-15 13:45:53","2022-04-15 13:45:53"
7760101,"Công tác xã hội","C00; D01; D14",15,18,0,29,"2022-04-15 13:45:53","2022-04-15 13:45:53"
7310608,"Đông phương học","C00; C19; D14; D15",15,18,0,29,"2022-04-15 13:45:53","2022-04-15 13:45:53"
7310101,"Kinh tế","A00; A01; D01",15,18,0,29,"2022-04-15 13:45:53","2022-04-15 13:45:53"
7220201,"Ngôn ngữ Anh","D01; A01; D14; D15",15,18,0,29,"2022-04-15 13:45:53","2022-04-15 13:45:53"
7850103,"Quản lý đất đai","A00; B00; D01; C04",15,18,0,29,"2022-04-15 13:45:53","2022-04-15 13:45:53"
7310205,"Quản lý nhà nước","C00; D01; D14; A00",15,18,0,29,"2022-04-15 13:45:53","2022-04-15 13:45:53"
7850101,"Quản lý tài nguyên và môi trường","A00; B00; D01; C04",15,18,0,29,"2022-04-15 13:45:53","2022-04-15 13:45:53"
7810103,"Quản trị dịch vụ du lịch lữ hành","A00; A01; D01; D14",15,18,0,29,"2022-04-15 13:45:53","2022-04-15 13:45:53"
7810201,"Quản trị khách sạn","A00; A01; D01",15,18,0,29,"2022-04-15 13:45:53","2022-04-15 13:45:53"
7310403,"Tâm lý học giáo dục","A00; C00; D01; C19",15,18,0,29,"2022-04-15 13:45:53","2022-04-15 13:45:53"
7229030,"Văn học","C00; D14; D15; C19",15,18,0,29,"2022-04-15 13:45:53","2022-04-15 13:45:53"
7310630,"Việt Nam học","C00; D01; D15; C19",15,18,0,29,"2022-04-15 13:45:53","2022-04-15 13:45:53"
7540101,"Công nghệ thực phẩm","A00; B00; D07; C02",15,18,0,29,"2022-04-15 13:45:53","2022-04-15 13:45:53"
