7510401C,"Công nghệ kỹ thuật hóa học","D07; D90",25.5,0,0,278,"2022-04-15 13:45:53","2022-04-15 13:45:53"
7510401D,"Công nghệ kỹ thuật hóa học","A00; B00",26,0,0,278,"2022-04-15 13:45:53","2022-04-15 13:45:53"
7510401D,"Công nghệ kỹ thuật hóa học","D07; D90",26.5,0,0,278,"2022-04-15 13:45:53","2022-04-15 13:45:53"
7510402D,"Công nghệ vật liệu",A00,23.75,0,0,278,"2022-04-15 13:45:53","2022-04-15 13:45:53"
7510402D,"Công nghệ vật liệu","A01; D07; D90",24.25,0,0,278,"2022-04-15 13:45:53","2022-04-15 13:45:53"
7510406C,"Công nghệ kỹ thuật môi trường","A00; B00",19.75,0,0,278,"2022-04-15 13:45:53","2022-04-15 13:45:53"
7510406C,"Công nghệ kỹ thuật môi trường","D07; D90",20.25,0,0,278,"2022-04-15 13:45:53","2022-04-15 13:45:53"
7510406D,"Công nghệ kỹ thuật môi trường","A00; B00",23.5,0,0,278,"2022-04-15 13:45:53","2022-04-15 13:45:53"
7510406D,"Công nghệ kỹ thuật môi trường","D07; D90",24,0,0,278,"2022-04-15 13:45:53","2022-04-15 13:45:53"
7510601A,"Quản lý công nghiệp",A00,24,0,0,278,"2022-04-15 13:45:53","2022-04-15 13:45:53"
7510601A,"Quản lý công nghiệp","A01; D01; D90",24.5,0,0,278,"2022-04-15 13:45:53","2022-04-15 13:45:53"
7510601C,"Quản lý công nghiệp",A00,24.25,0,0,278,"2022-04-15 13:45:53","2022-04-15 13:45:53"
7510601C,"Quản lý công nghiệp","A01; D01; D90",24.75,0,0,278,"2022-04-15 13:45:53","2022-04-15 13:45:53"
7510601D,"Quản lý công nghiệp",A00,25.75,0,0,278,"2022-04-15 13:45:53","2022-04-15 13:45:53"
7510601D,"Quản lý công nghiệp","A01; D01; D90",26.25,0,0,278,"2022-04-15 13:45:53","2022-04-15 13:45:53"
7510605D,"Logistic và quản lý chuỗi cung ứng",A00,26.25,0,0,278,"2022-04-15 13:45:53","2022-04-15 13:45:53"
7510605D,"Logistic và quản lý chuỗi cung ứng","A01; D01; D90",26.75,0,0,278,"2022-04-15 13:45:53","2022-04-15 13:45:53"
7510605NT,"Logistic và quản lý chuỗi cung ứng",A00,28.25,0,0,278,"2022-04-15 13:45:53","2022-04-15 13:45:53"
7510605NT,"Logistic và quản lý chuỗi cung ứng","A01; D01; D90",28.75,0,0,278,"2022-04-15 13:45:53","2022-04-15 13:45:53"
7510801C,"Công nghệ kỹ thuật in",A00,20.25,0,0,278,"2022-04-15 13:45:53","2022-04-15 13:45:53"
7510801C,"Công nghệ kỹ thuật in","A01; D01; D90",20.75,0,0,278,"2022-04-15 13:45:53","2022-04-15 13:45:53"
7510801D,"Công nghệ kỹ thuật in",A00,24.25,0,0,278,"2022-04-15 13:45:53","2022-04-15 13:45:53"
7510801D,"Công nghệ kỹ thuật in","A01; D01; D90",24.75,0,0,278,"2022-04-15 13:45:53","2022-04-15 13:45:53"
7520117D,"Kỹ thuật công nghiệp",A00,24.75,0,0,278,"2022-04-15 13:45:53","2022-04-15 13:45:53"
7520117D,"Kỹ thuật công nghiệp","A01; D01; D90",25.25,0,0,278,"2022-04-15 13:45:53","2022-04-15 13:45:53"
7520212D,"Kỹ thuật y sinh (Điện tử y sinh)",A00,25,0,0,278,"2022-04-15 13:45:53","2022-04-15 13:45:53"
7520212D,"Kỹ thuật y sinh (Điện tử y sinh)","A01; D01; D90",25.5,0,0,278,"2022-04-15 13:45:53","2022-04-15 13:45:53"
7540101A,"Công nghệ thực phẩm","A00; B00",23,0,0,278,"2022-04-15 13:45:53","2022-04-15 13:45:53"
7540101A,"Công nghệ thực phẩm","D07; D90",23.5,0,0,278,"2022-04-15 13:45:53","2022-04-15 13:45:53"
7540101C,"Công nghệ thực phẩm","A00; B00",24.5,0,0,278,"2022-04-15 13:45:53","2022-04-15 13:45:53"
7540101C,"Công nghệ thực phẩm","D07; D90",25,0,0,278,"2022-04-15 13:45:53","2022-04-15 13:45:53"
7540101D,"Công nghệ thực phẩm","A00; B00",26,0,0,278,"2022-04-15 13:45:53","2022-04-15 13:45:53"
7540101D,"Công nghệ thực phẩm","D07; D90",26.5,0,0,278,"2022-04-15 13:45:53","2022-04-15 13:45:53"
7540209C,"Công nghệ may",A00,19.25,0,0,278,"2022-04-15 13:45:53","2022-04-15 13:45:53"
7540209C,"Công nghệ may","A01; D01; D90",19.75,0,0,278,"2022-04-15 13:45:53","2022-04-15 13:45:53"
7540209D,"Công nghệ may",A00,24.5,0,0,278,"2022-04-15 13:45:53","2022-04-15 13:45:53"
7540209D,"Công nghệ may","A01; D01; D90",25,0,0,278,"2022-04-15 13:45:53","2022-04-15 13:45:53"
7549002D,"Kỹ thuật gỗ và nội thất",A00,23.75,0,0,278,"2022-04-15 13:45:53","2022-04-15 13:45:53"
7549002D,"Kỹ thuật gỗ và nội thất","A01; D01; D90",24.25,0,0,278,"2022-04-15 13:45:53","2022-04-15 13:45:53"
7580101D,"Kiến trúc","V03; V04",22.5,0,0,278,"2022-04-15 13:45:53","2022-04-15 13:45:53"
7580101D,"Kiến trúc","V05; V06",23,0,0,278,"2022-04-15 13:45:53","2022-04-15 13:45:53"
7580103D,"Kiến trúc nội thất","V03; V04",22.5,0,0,278,"2022-04-15 13:45:53","2022-04-15 13:45:53"
7580103D,"Kiến trúc nội thất","V05; V06",23,0,0,278,"2022-04-15 13:45:53","2022-04-15 13:45:53"
7580205D,"Kỹ thuật xây dựng công trình giao thông",A00,23.5,0,0,278,"2022-04-15 13:45:53","2022-04-15 13:45:53"
7580205D,"Kỹ thuật xây dựng công trình giao thông","A01; D01; D90",24,0,0,278,"2022-04-15 13:45:53","2022-04-15 13:45:53"
7580302D,"Quản lý xây dựng",A00,24,0,0,278,"2022-04-15 13:45:53","2022-04-15 13:45:53"
7580302D,"Quản lý xây dựng","A01; D01; D90",24.5,0,0,278,"2022-04-15 13:45:53","2022-04-15 13:45:53"
7810202D,"Quản trị nhà hàng và dịch vụ ăn uống",A00,24.25,0,0,278,"2022-04-15 13:45:53","2022-04-15 13:45:53"
7810202D,"Quản trị nhà hàng và dịch vụ ăn uống","A01; D01; D07",24.75,0,0,278,"2022-04-15 13:45:53","2022-04-15 13:45:53"
7840110D,"Quản lý và vận hành hạ tầng",A00,19,0,0,278,"2022-04-15 13:45:53","2022-04-15 13:45:53"
7840110D,"Quản lý và vận hành hạ tầng","A01; D01; D90",19.5,0,0,278,"2022-04-15 13:45:53","2022-04-15 13:45:53"
7340101QK,"Quản trị kinh doanh (Kettering - Mỹ)","A00; A01; D01; D90",16,0,0,278,"2022-04-15 13:45:53","2022-04-15 13:45:53"
7340101QN,"Quản trị kinh doanh (Northampton - Anh)","A00; A01; D01; D90",16,0,0,278,"2022-04-15 13:45:53","2022-04-15 13:45:53"
7340101QS,"Quản trị kinh doanh (Sunderland - Anh)","A00; A01; D01; D90",16,0,0,278,"2022-04-15 13:45:53","2022-04-15 13:45:53"
7340115QN,"Quản trị Marketing (Northampton - Anh)","A00; A01; D01; D90",16,0,0,278,"2022-04-15 13:45:53","2022-04-15 13:45:53"
7340201QS,"Tài chính ngân hàng (Sunderland - Anh)","A00; A01; D01; D90",16,0,0,278,"2022-04-15 13:45:53","2022-04-15 13:45:53"
7340301QN,"Kế toán quốc tế ( Northampton - Anh)","A00; A01; D01; D90",16,0,0,278,"2022-04-15 13:45:53","2022-04-15 13:45:53"
7340303QS,"Kế toán và quản trị tài chính (Sunderland - Anh)","A00; A01; D01; D90",16,0,0,278,"2022-04-15 13:45:53","2022-04-15 13:45:53"
7480106QK,"Kỹ thuật máy tính (Kettering - Mỹ)","A00; A01; D01; D90",16,0,0,278,"2022-04-15 13:45:53","2022-04-15 13:45:53"
7480201QA,"Công nghệ thông tin (Adelaide - Úc)","A00; A01; D01; D90",16,0,0,278,"2022-04-15 13:45:53","2022-04-15 13:45:53"
7480201QT,"Công nghệ thông tin (Tongmyong - Hàn Quốc)","A00; A01; D01; D90",16,0,0,278,"2022-04-15 13:45:53","2022-04-15 13:45:53"
7510606QN,"Logistic và Tài chính thương mại (Northampton - Anh)","A00; A01; D01; D90",16,0,0,278,"2022-04-15 13:45:53","2022-04-15 13:45:53"
7520103QK,"Kỹ thuật cơ khí (Kettering - Mỹ)","A00; A01; D01; D90",16,0,0,278,"2022-04-15 13:45:53","2022-04-15 13:45:53"
7520103QT,"Kỹ thuật cơ khí (Tongmyong - Hàn Quốc)","A00; A01; D01; D90",16,0,0,278,"2022-04-15 13:45:53","2022-04-15 13:45:53"
7520114QM,"Kỹ thuật cơ điện tử (Middlesex - Anh)","A00; A01; D01; D90",16,0,0,278,"2022-04-15 13:45:53","2022-04-15 13:45:53"
7520114QT,"Kỹ thuật cơ điện tử (Tongmyong - Hàn Quốc)","A00; A01; D01; D90",16,0,0,278,"2022-04-15 13:45:53","2022-04-15 13:45:53"
7520119QK,"Kỹ thuật chế tạo máy và công nghiệp (Kettering - Mỹ)","A00; A01; D01; D90",16,0,0,278,"2022-04-15 13:45:53","2022-04-15 13:45:53"
7520202QS,"Kỹ thuật điện - điện tử (Sunderland - Anh)","A00; A01; D01; D90",16,0,0,278,"2022-04-15 13:45:53","2022-04-15 13:45:53"
7520202QT,"Kỹ thuật điện - điện tử (Tongmyong - Hàn Quốc)","A00; A01; D01; D90",16,0,0,278,"2022-04-15 13:45:53","2022-04-15 13:45:53"
7580201QA,"Kỹ thuật xây dựng (Adelaide - Úc)","A00; A01; D01; D90",16,0,0,278,"2022-04-15 13:45:53","2022-04-15 13:45:53"
7810203QN,"Quản lý nhà hàng và khách sạn (Northampton - Anh)","A01; C00; D01; D15",16,0,0,278,"2022-04-15 13:45:53","2022-04-15 13:45:53"
7140201,"Giáo dục Mầm non",M00,22.05,24,0,279,"2022-04-15 13:45:53","2022-04-15 13:45:53"
7140202,"Giáo dục Tiểu học","A00; A01; D01",25.4,28.18,0,279,"2022-04-15 13:45:53","2022-04-15 13:45:53"
7140203,"Giáo dục Đặc biệt","D01; C00; C15",23.4,25.7,0,279,"2022-04-15 13:45:53","2022-04-15 13:45:53"
7140205,"Giáo dục Chính trị","C00; C19; D01",25.75,27.9,0,279,"2022-04-15 13:45:53","2022-04-15 13:45:53"
7140206,"Giáo dục Thể chất","M08; T01",23.75,25.37,0,279,"2022-04-15 13:45:53","2022-04-15 13:45:53"
7140208,"Giáo dục Quốc phòng - An ninh","C00; C19; A08",24.4,25.48,0,279,"2022-04-15 13:45:53","2022-04-15 13:45:53"
7140209,"Sư phạm Toán học","A00; A01",26.7,29.52,0,279,"2022-04-15 13:45:53","2022-04-15 13:45:53"
7140210,"Sư phạm Tin học","A00; A01",23,26.98,0,279,"2022-04-15 13:45:53","2022-04-15 13:45:53"
7140211,"Sư phạm Vật lý","A00; A01; C01",25.8,29.07,0,279,"2022-04-15 13:45:53","2022-04-15 13:45:53"
7140212,"Sư phạm Hóa học","A00; B00; D07",27,29.75,0,279,"2022-04-15 13:45:53","2022-04-15 13:45:53"
7140213,"Sư phạm Sinh học","B00; D08",25,28.67,0,279,"2022-04-15 13:45:53","2022-04-15 13:45:53"
7140217,"Sư phạm Ngữ văn","D01; C00; D78",27,28.57,0,279,"2022-04-15 13:45:53","2022-04-15 13:45:53"
7140218,"Sư phạm Lịch sử","C00; D14",26,27.8,0,279,"2022-04-15 13:45:53","2022-04-15 13:45:53"
7140219,"Sư phạm Địa lý","C00; C04; D78",25.2,27.2,0,279,"2022-04-15 13:45:53","2022-04-15 13:45:53"
7140231,"Sư phạm Tiếng Anh",D01,27.15,28.28,0,279,"2022-04-15 13:45:53","2022-04-15 13:45:53"
7140234,"Sư phạm Tiếng Trung Quốc","D04; D01",25.5,27.75,0,279,"2022-04-15 13:45:53","2022-04-15 13:45:53"
7140247,"Sư phạm Khoa học tự nhiên","A00; B00; D90",24.4,28.4,0,279,"2022-04-15 13:45:53","2022-04-15 13:45:53"
7140249,"Sư phạm Lịch sử - Địa lý","C00; C19; C20",25,25.63,0,279,"2022-04-15 13:45:53","2022-04-15 13:45:53"
7140101,"Giáo dục học","B00; C00; C01; D01",19.5,24,0,279,"2022-04-15 13:45:53","2022-04-15 13:45:53"
7140114,"Quản lý giáo dục","D01; A00; C00",23.3,27.5,0,279,"2022-04-15 13:45:53","2022-04-15 13:45:53"
7220201,"Ngôn ngữ Anh",D01,26,27.92,0,279,"2022-04-15 13:45:53","2022-04-15 13:45:53"
7220202,"Ngôn ngữ Nga","D02; D80; D01; D78",20.53,24.82,0,279,"2022-04-15 13:45:53","2022-04-15 13:45:53"
7220203,"Ngôn ngữ Pháp","D03; D01",22.8,25.77,0,279,"2022-04-15 13:45:53","2022-04-15 13:45:53"
7220204,"Ngôn ngữ Trung Quốc","D04; D01",25.2,26.78,0,279,"2022-04-15 13:45:53","2022-04-15 13:45:53"
7220209,"Ngôn ngữ Nhật","D06; D01",24.9,26.38,0,279,"2022-04-15 13:45:53","2022-04-15 13:45:53"
7220210,"Ngôn ngữ Hàn Quốc","D01; D96; D78; DD2",25.8,27.7,0,279,"2022-04-15 13:45:53","2022-04-15 13:45:53"
7229030,"Văn học","D01; C00; D78",24.3,27.12,0,279,"2022-04-15 13:45:53","2022-04-15 13:45:53"
7310401,"Tâm lý học","B00; C00; D01",25.5,28,0,279,"2022-04-15 13:45:53","2022-04-15 13:45:53"
7310403,"Tâm lý học giáo dục","A00; D01; C00",23.7,27.1,0,279,"2022-04-15 13:45:53","2022-04-15 13:45:53"
7310601,"Quốc tế học","D01; D14; D78",24.6,26.57,0,279,"2022-04-15 13:45:53","2022-04-15 13:45:53"
7310630,"Việt Nam học","C00; D01; D78",22.92,26.58,0,279,"2022-04-15 13:45:53","2022-04-15 13:45:53"
7440112,"Hóa học","A00; B00; D07",23.25,27.5,0,279,"2022-04-15 13:45:53","2022-04-15 13:45:53"
7480201,"Công nghệ thông tin","A00; A01",24,27.55,0,279,"2022-04-15 13:45:53","2022-04-15 13:45:53"
7760101,"Công tác xã hội","A00; D01; C00",22.5,26.67,0,279,"2022-04-15 13:45:53","2022-04-15 13:45:53"
7140206,"Giáo dục thể chất","T00; T04; T05; T06",24,0,0,281,"2022-04-15 13:45:53","2022-04-15 13:45:53"
7140207,"Huấn luyện thể thao","T00; T04; T05; T06",24,0,0,281,"2022-04-15 13:45:53","2022-04-15 13:45:53"
7729001,"Y sinh học TDTT","T00; T03; T05; T06",21,0,0,281,"2022-04-15 13:45:53","2022-04-15 13:45:53"
7810301,"Quản lý TDTT","T00; T03; T05; T06",21,0,0,281,"2022-04-15 13:45:53","2022-04-15 13:45:53"
7720101TP,"Y khoa",B00,26.35,0,0,283,"2022-04-15 13:45:53","2022-04-15 13:45:53"
7720101TQ,"Y khoa",B00,27.35,0,0,283,"2022-04-15 13:45:53","2022-04-15 13:45:53"
7720201TP,"Dược học",B00,26.15,0,0,283,"2022-04-15 13:45:53","2022-04-15 13:45:53"
7720201TQ,"Dược học",B00,26.35,0,0,283,"2022-04-15 13:45:53","2022-04-15 13:45:53"
7720301TP,"Điều dưỡng",B00,24.25,0,0,283,"2022-04-15 13:45:53","2022-04-15 13:45:53"
7720301TQ,"Điều dưỡng",B00,24,0,0,283,"2022-04-15 13:45:53","2022-04-15 13:45:53"
7720401TP,"Dinh dưỡng",B00,23.8,0,0,283,"2022-04-15 13:45:53","2022-04-15 13:45:53"
7720401TQ,"Dinh dưỡng",B00,23.45,0,0,283,"2022-04-15 13:45:53","2022-04-15 13:45:53"
7720501TP,"Răng Hàm Mặt",B00,26.6,0,0,283,"2022-04-15 13:45:53","2022-04-15 13:45:53"
7720501TQ,"Răng Hàm Mặt",B00,27.35,0,0,283,"2022-04-15 13:45:53","2022-04-15 13:45:53"
7720601TP,"Kỹ thuật xét nghiệm y học",B00,25.6,0,0,283,"2022-04-15 13:45:53","2022-04-15 13:45:53"
7720601TQ,"Kỹ thuật xét nghiệm y học",B00,25.7,0,0,283,"2022-04-15 13:45:53","2022-04-15 13:45:53"
7720602TP,"Kỹ thuật hình ảnh y học",B00,24.85,0,0,283,"2022-04-15 13:45:53","2022-04-15 13:45:53"
7720602TQ,"Kỹ thuật hình ảnh y học",B00,24.7,0,0,283,"2022-04-15 13:45:53","2022-04-15 13:45:53"
7720699TP,"Khúc xạ nhãn khoa",B00,24.7,0,0,283,"2022-04-15 13:45:53","2022-04-15 13:45:53"
7720699TQ,"Khúc xạ nhãn khoa",B00,24.9,0,0,283,"2022-04-15 13:45:53","2022-04-15 13:45:53"
7720701TP,"Y tế công cộng",B00,23.15,0,0,283,"2022-04-15 13:45:53","2022-04-15 13:45:53"
7720701TQ,"Y tế công cộng",B00,21.35,0,0,283,"2022-04-15 13:45:53","2022-04-15 13:45:53"
7340115,Marketing,"A00; A01; D01; C00",24,30,650,284,"2022-04-15 13:45:53","2022-04-15 13:45:53"
7510605,"Logistics và quản lý chuỗi cung ứng","A00; A01; D01; C00",24,30,700,284,"2022-04-15 13:45:53","2022-04-15 13:45:53"
7340120,"Kinh doanh quốc tế","A00; A01; D01; C00",23,30,750,284,"2022-04-15 13:45:53","2022-04-15 13:45:53"
7340122,"Thương mại điện tử","A00; A01; D01; C01",23,30,650,284,"2022-04-15 13:45:53","2022-04-15 13:45:53"
7320108,"Quan hệ công chúng","A00; A01; D01; C00",23,30,650,284,"2022-04-15 13:45:53","2022-04-15 13:45:53"
7340101,"Quản trị kinh doanh","A00; A01; D01; C00",22,30,700,284,"2022-04-15 13:45:53","2022-04-15 13:45:53"
7340404,"Quản trị nhân lực","A00; A01; D01; C00",22,30,650,284,"2022-04-15 13:45:53","2022-04-15 13:45:53"
7480201,"Công nghệ thông tin","A00; A01; D01; C01",22,30,650,284,"2022-04-15 13:45:53","2022-04-15 13:45:53"
7310206,"Quan hệ quốc tế","A01; D01; D14; D15",21,30,750,284,"2022-04-15 13:45:53","2022-04-15 13:45:53"
7340121,"Kinh doanh thương mại","A00; A01; D01; C00",21,30,650,284,"2022-04-15 13:45:53","2022-04-15 13:45:53"
7810201,"Quản trị khách sạn","A00; A01; D01; C00",21,30,650,284,"2022-04-15 13:45:53","2022-04-15 13:45:53"
7220201,"Ngôn ngữ Anh","A01; D01; D14; D15",21,30,650,284,"2022-04-15 13:45:53","2022-04-15 13:45:53"
7210403,"Thiết kế đồ họa","A00; A01; D01; C01",21,30,650,284,"2022-04-15 13:45:53","2022-04-15 13:45:53"
7310401,"Tâm lý học","D01; C00; D14; D15",21,30,650,284,"2022-04-15 13:45:53","2022-04-15 13:45:53"
7810202,"Quản trị nhà hàng và dịch vụ ăn uống","A00; A01; D01; C00",20,30,650,284,"2022-04-15 13:45:53","2022-04-15 13:45:53"
7810103,"Quản trị dịch vụ du lịch và lữ hành","A00; A01; D01; C00",20,30,650,284,"2022-04-15 13:45:53","2022-04-15 13:45:53"
7320106,"Công nghệ truyền thông","A00; A01; D01; C00",20,30,650,284,"2022-04-15 13:45:53","2022-04-15 13:45:53"
7340201,"Tài chính - Ngân hàng","A00; A01; D01; C01",20,30,650,284,"2022-04-15 13:45:53","2022-04-15 13:45:53"
7380108,"Luật quốc tế","A00; A01; D01; C00",20,30,750,284,"2022-04-15 13:45:53","2022-04-15 13:45:53"
7340116,"Bất động sản","A00; A01; D01; C00",20,30,650,284,"2022-04-15 13:45:53","2022-04-15 13:45:53"
7340206,"Tài chính quốc tế","A00; A01; D01; C01",20,30,650,284,"2022-04-15 13:45:53","2022-04-15 13:45:53"
7340301,"Kế toán","A00; A01; D01; C01",19,30,650,284,"2022-04-15 13:45:53","2022-04-15 13:45:53"
7380101,Luật,"A00; A01; D01; C00",19,30,650,284,"2022-04-15 13:45:53","2022-04-15 13:45:53"
7380107,"Luật kinh tế","A00; A01; D01; C00",19,30,650,284,"2022-04-15 13:45:53","2022-04-15 13:45:53"
7220204,"Ngôn ngữ Trung Quốc","A01; D01; D14; D15",19,30,650,284,"2022-04-15 13:45:53","2022-04-15 13:45:53"
7220209,"Ngôn ngữ Nhật","A01; D01; D14; D15",19,30,650,284,"2022-04-15 13:45:53","2022-04-15 13:45:53"
7220210,"Ngôn ngữ Hàn Quốc","A01; D01; D14; D15",19,30,700,284,"2022-04-15 13:45:53","2022-04-15 13:45:53"
7320110,"Quảng cáo","A00; A01; D01; C00",19,30,650,284,"2022-04-15 13:45:53","2022-04-15 13:45:53"
7480109,"Khoa học dữ liệu","A00; A01; D01; C01",19,30,650,284,"2022-04-15 13:45:53","2022-04-15 13:45:53"
7580101,"Kiến trúc (ARC)","A00; A01; V00; V02",20,0,0,285,"2022-04-15 13:45:53","2022-04-15 13:45:53"
7580201,"Kỹ thuật xây dựng (BCE)","A00; A01; D07",19,0,0,285,"2022-04-15 13:45:53","2022-04-15 13:45:53"
7340101,"Quản trị kinh doanh (BBA)","A00; A01; D01; D03; D05",20,0,0,285,"2022-04-15 13:45:53","2022-04-15 13:45:53"
7340202,"Tài chính và Kế toán (BFA)","A00; A01; D01; D03; D05",20,0,0,285,"2022-04-15 13:45:53","2022-04-15 13:45:53"
7480101,"Khoa học máy tính (CSE)","A00; A01; D07",23,0,0,285,"2022-04-15 13:45:53","2022-04-15 13:45:53"
7520208,"Kỹ thuật điện và máy tính (ECE)","A00; A01; D07",21,0,0,285,"2022-04-15 13:45:53","2022-04-15 13:45:53"
7520103,"Kỹ thuật cơ khí (MEN)","A00; A01; D07",21,0,0,285,"2022-04-15 13:45:53","2022-04-15 13:45:53"
7220112,"Ngành Văn hóa các dân tộc thiểu số Việt Nam","C00; D01; D09; D15",15,15.5,0,286,"2022-04-15 13:45:53","2022-04-15 13:45:53"
7320201,"Ngành Thông tin - Thư viện","C00; D01; D09; D15",15,15.5,0,286,"2022-04-15 13:45:53","2022-04-15 13:45:53"
7320305,"Ngành Bảo tàng học","C00; D01; D09; D15",15,15.5,0,286,"2022-04-15 13:45:53","2022-04-15 13:45:53"
7320402,"Ngành Kinh doanh xuất bản phẩm","C00; D01; D10; D15",15,15.5,0,286,"2022-04-15 13:45:53","2022-04-15 13:45:53"
7229040A,"Ngành Văn hóa học, chuyên ngành Văn hóa Việt Nam","C00; D01; D09; D15",16,16,0,286,"2022-04-15 13:45:53","2022-04-15 13:45:53"
7229040B,"Ngành Văn hóa học, chuyên ngành Công nghiệp Văn hóa","C00; D01; D09; D15",16,16,0,286,"2022-04-15 13:45:53","2022-04-15 13:45:53"
7229040C,"Ngành Văn hóa học, chuyên ngành Truyền thông Văn hóa","C00; D01; D09; D15",23,22.5,0,286,"2022-04-15 13:45:53","2022-04-15 13:45:53"
7229042A,"Ngành Quản lý văn hóa, chuyên ngành Quản lý hoạt động văn hóa xã hội","C00; D01; D09; D15",21,22.25,0,286,"2022-04-15 13:45:53","2022-04-15 13:45:53"
7229042B,"Ngành Quản lý văn hóa, chuyên ngành Quản lý di sản văn hóa và phát triển du lịch","C00; D01; D09; D15",16,16,0,286,"2022-04-15 13:45:53","2022-04-15 13:45:53"
7229042C,"Ngành Quản lý văn hóa, chuyên ngành Tổ chức, dàn dựng chương trình văn hóa nghệ thuật","R01; R02; R03; R04",18,19.25,0,286,"2022-04-15 13:45:53","2022-04-15 13:45:53"
7229042D,"Ngành Quản lý văn hóa, chuyên ngành Tổ chức sự kiện văn hóa, thể thao, du lịch","C00; D01; D09; D15",22.5,23.25,0,286,"2022-04-15 13:45:53","2022-04-15 13:45:53"
7810101,"Ngành du lịch","C00; D01; D10; D15",24.25,23.75,0,286,"2022-04-15 13:45:53","2022-04-15 13:45:53"
7810103A,"Ngành Quản trị dịch vụ du lịch và lữ hành, chuyên ngành Quản trị lữ hành","C00; D01; D10; D15",25,25,0,286,"2022-04-15 13:45:53","2022-04-15 13:45:53"
7810103B,"Ngành Quản trị dịch vụ du lịch và lữ hành, chuyên ngành Hướng dẫn du lịch","C00; D01; D10; D15",24,23.75,0,286,"2022-04-15 13:45:53","2022-04-15 13:45:53"
7720101,"Y khoa",B00,28.2,0,0,288,"2022-04-15 13:45:53","2022-04-15 13:45:53"
7720101_02,"Y khoa (kết hợp chứng chỉ tiếng Anh quốc tế)",B00,27.65,0,0,288,"2022-04-15 13:45:53","2022-04-15 13:45:53"
7720110,"Y học dự phòng",B00,23.9,0,0,288,"2022-04-15 13:45:53","2022-04-15 13:45:53"
7720115,"Y học cổ truyền",B00,25.2,0,0,288,"2022-04-15 13:45:53","2022-04-15 13:45:53"
7720201,"Dược học",B00,26.25,0,0,288,"2022-04-15 13:45:53","2022-04-15 13:45:53"
7720201,"Dược học",A00,26.25,0,0,288,"2022-04-15 13:45:53","2022-04-15 13:45:53"
7720201_02,"Dược học (kết hợp chứng chỉ tiếng Anh quốc tế)",B00,24.5,0,0,288,"2022-04-15 13:45:53","2022-04-15 13:45:53"
7720201_02,"Dược học (kết hợp chứng chỉ tiếng Anh quốc tế)",A00,24.5,0,0,288,"2022-04-15 13:45:53","2022-04-15 13:45:53"
7720301,"Điều dưỡng",B00,24.1,0,0,288,"2022-04-15 13:45:53","2022-04-15 13:45:53"
7720301_04,"Điều dưỡng (kết hợp chứng chỉ tiếng Anh quốc tế)",B00,22.8,0,0,288,"2022-04-15 13:45:53","2022-04-15 13:45:53"
7720301_03,"Điều dưỡng chuyên ngành Gây mê hồi sức",B00,24.15,0,0,288,"2022-04-15 13:45:53","2022-04-15 13:45:53"
7720302,"Hộ sinh (chỉ tuyển nữ)",B00,23.25,0,0,288,"2022-04-15 13:45:53","2022-04-15 13:45:53"
7720401,"Dinh dưỡng",B00,24,0,0,288,"2022-04-15 13:45:53","2022-04-15 13:45:53"
7720501,"Răng - Hàm - Mặt",B00,27.65,0,0,288,"2022-04-15 13:45:53","2022-04-15 13:45:53"
7720501_02,"Răng - Hàm - Mặt (kết hợp chứng chỉ tiếng Anh quốc tế)",B00,27.4,0,0,288,"2022-04-15 13:45:53","2022-04-15 13:45:53"
7720502,"Kỹ thuật phục hình răng",B00,25,0,0,288,"2022-04-15 13:45:53","2022-04-15 13:45:53"
7720601,"Kỹ thuật xét nghiệm y học",B00,25.45,0,0,288,"2022-04-15 13:45:53","2022-04-15 13:45:53"
7720602,"Kỹ thuật hình ảnh y học",B00,24.8,0,0,288,"2022-04-15 13:45:53","2022-04-15 13:45:53"
7720603,"Kỹ thuật phục hồi chức năng",B00,24.1,0,0,288,"2022-04-15 13:45:53","2022-04-15 13:45:53"
7720701,"Y tế công cộng",B00,22,0,0,288,"2022-04-15 13:45:53","2022-04-15 13:45:53"
7380101,Luật,"A00; C00; C20; D66",18.5,20,0,315,"2022-04-15 13:45:53","2022-04-15 13:45:53"
7380107,"Luật Kinh tế","A00; C00; C20; D01",18.5,20,0,315,"2022-04-15 13:45:53","2022-04-15 13:45:53"
7140206,"Giáo dục Thể chất","T00; T02; T05; T07",25.88,0,0,316,"2022-04-15 13:45:53","2022-04-15 13:45:53"
7340101,"Quản trị kinh doanh","A00; C00; D01; D10",17,0,0,317,"2022-04-15 13:45:53","2022-04-15 13:45:53"
7810101,"Du lich","A00; C00; D01; D10",17,0,0,317,"2022-04-15 13:45:53","2022-04-15 13:45:53"
7810102,"Du lịch điện tử","A00; A01; D01; D10",16.5,0,0,317,"2022-04-15 13:45:53","2022-04-15 13:45:53"
7810103,"Quản trị dịch vụ du lịch và lữ hành","A00; C00; D01; D10",17,0,0,317,"2022-04-15 13:45:53","2022-04-15 13:45:53"
7810104,"Quản trị du lịch và khách sạn","A00; C00; D01; D10",20,0,0,317,"2022-04-15 13:45:53","2022-04-15 13:45:53"
7810201,"Quản trị khách sạn","A00; C00; D01; D10",17,0,0,317,"2022-04-15 13:45:53","2022-04-15 13:45:53"
7810202,"Quản trị nhà hàng và dịch vụ ăn uống","A00; C00; D01; D10",17,0,0,317,"2022-04-15 13:45:53","2022-04-15 13:45:53"
7480112,"Khoa học dữ liệu và Trí tuệ nhân tạo (hệ cử nhân)","A00; A01; D01",18,0,0,318,"2022-04-15 13:45:53","2022-04-15 13:45:53"
7480112KS,"Khoa học dữ liệu và Trí tuệ nhân tạo (hệ kỹ sư)","A00; A01; D01",18,0,0,318,"2022-04-15 13:45:53","2022-04-15 13:45:53"
7520216,"Kỹ thuật điều khiển và Tự động hóa (hệ kỹ sư và hệ cử nhân)","A00; A01; D01",18,0,0,318,"2022-04-15 13:45:53","2022-04-15 13:45:53"
7520201,"Kỹ thuật điện","A00; A01; D01",16.25,0,0,318,"2022-04-15 13:45:53","2022-04-15 13:45:53"
7140231,"Sư Phạm tiếng Anh","D01; D14; D15",25.75,26,0,319,"2022-04-15 13:45:53","2022-04-15 13:45:53"
7140233,"Sư Phạm tiếng Pháp","D01; D03; D15; D44",19,18,0,319,"2022-04-15 13:45:53","2022-04-15 13:45:53"
7140234,"Sư Phạm tiếng Trung","D01; D04; D15; D45",23,24,0,319,"2022-04-15 13:45:53","2022-04-15 13:45:53"
7310630,"Việt Nam học","D01; D14; D15",15,18,0,319,"2022-04-15 13:45:53","2022-04-15 13:45:53"
7220201,"Ngôn ngữ Anh","D01; D14; D15",22.25,23,0,319,"2022-04-15 13:45:53","2022-04-15 13:45:53"
7220202,"Ngôn ngữ Nga","D01; D02; D15; D42",15,18,0,319,"2022-04-15 13:45:53","2022-04-15 13:45:53"
7220203,"Ngôn ngữ Pháp","D01; D03; D15; D44",15,18,0,319,"2022-04-15 13:45:53","2022-04-15 13:45:53"
7220204,"Ngôn ngữ Trung Quốc","D01; D04; D15; D45",23.75,24,0,319,"2022-04-15 13:45:53","2022-04-15 13:45:53"
7220209,"Ngôn ngữ Nhật","D01; D06; D15; D43",21.5,23,0,319,"2022-04-15 13:45:53","2022-04-15 13:45:53"
7220210,"Ngôn ngữ Hàn","D01; D14; D15",23.5,25,0,319,"2022-04-15 13:45:53","2022-04-15 13:45:53"
7310601,"Quốc tế học","D01; D14; D15",15,18,0,319,"2022-04-15 13:45:53","2022-04-15 13:45:53"
7310206,"Quan hệ quốc tế","A01; C00; D01; D14",19.5,0,0,320,"2022-04-15 13:45:53","2022-04-15 13:45:53"
7320104,"Truyền thông đa phương tiện","A00; C00; C15; D01",19.5,0,0,320,"2022-04-15 13:45:53","2022-04-15 13:45:53"
7340101,"Quản trị kinh doanh","A00; A01; D01; C15",22,0,0,321,"2022-04-15 13:45:53","2022-04-15 13:45:53"
7340115,Marketing,"A00; A01; D01; C15",23,0,0,321,"2022-04-15 13:45:53","2022-04-15 13:45:53"
7340404,"Quản trị nhân lực","A00; A01; D01; C15",17,0,0,321,"2022-04-15 13:45:53","2022-04-15 13:45:53"
